szerzo,cim,jelzet,raktar,kiado,ev,targyszavak,kulso_leiras,megjegyzesek
Miskolczi Miklós,Harangoznak : Röpirat az öregségről,308 M70,,IPV,1988,idősek; gerontológia; szociológia; szociográfia; társadalomrajz; Magyarország,http://nektar.oszk.hu/hu/manifestation/664465,
Moldova György,Akit a mozdony füstje megcsapott,308 M76,,Szépirodalmi,1977,szociográfia; riport; vasutasok,http://nektar.oszk.hu/hu/manifestation/623475,
Csupor Tibor,Mikor Csíkból elindultam : A bukovinai székelyek élettörténete,308 MF,,Szépirodalmi,1987,magyar történelem; székely történelem; szociográfia; Magyarország felfedezése sorozat,http://nektar.oszk.hu/hu/manifestation/628055,
Bálint B. András,Szabadulás a félelemtől : vallásszociográfia,308 MF B20,,Szépirodalmi,1992,szociográfia; vallásszociológia; Magyarország felfedezése sorozat,http://nektar.oszk.hu/hu/manifestation/45757,
Berkovits György,Világváros határában,308 MF B55,,Szépirodalmi,1976,szociológia; szociográfia; Pest megye; Budapest; Magyarország felfedezése sorozat,http://nektar.oszk.hu/hu/manifestation/1425048,
Bertha Bulcsu,Balatoni évtizedek,308 MF B57,,Szépirodalmi,1973,szociológia; szociográfia; helytörténet; turizmus; borászat; halászat; horgászat; hajózás; Magyarország felfedezése sorozat,http://nektar.oszk.hu/hu/manifestation/1324637,
Csák Gyula,"Szikföld sóhaja, A",308 MF C35,,Szépirodalmi,1977,szociológia; szociográfia; honismeret; helytörténet; Püspökladány; Magyarország felfedezése sorozat,http://nektar.oszk.hu/hu/manifestation/623842,
Erdei Ferenc,Város és vidéke,308 MF E66,,Szépirodalmi,1972,szociológia; szociográfia; Csongrád megye; Szeged; Hódmezővásárhely; Makó; Szentes; Csongrád; Magyarország felfedezése sorozat,http://nektar.oszk.hu/hu/manifestation/1322121,
Fekete Gyula,Éljünk magunknak?,308 MF F37,,Szépirodalmi,1972,szociológia; szociográfia; demográfia; statisztika; Magyarország felfedezése sorozat,http://nektar.oszk.hu/hu/manifestation/1321967,
"Berkovits György - Lázár István (vál., szerk.)",Folyamatos jelen : Fiatal szociográfusok antológiája,308 MF F69,,Szépirodalmi,1981,szociológia; szociográfia; faluszociológia; társadalomrajz; Magyarország felfedezése sorozat; antológia,http://nektar.oszk.hu/hu/manifestation/625129,
Hernádi Miklós,Válni veszélyes! : Családbomlás Magyarországon,308 MF H64,,Háttér,1989,családszociológia; szociográfia; pszichológia; házasság; Magyarország felfedezése sorozat,http://nektar.oszk.hu/hu/manifestation/740048,
Jócsik Lajos,"Ország a csillagon, Egy",308 MF J65,,Szépirodalmi,1977,szociológia; szociográfia; ökológia; természetvédelem; környezetvédelem; Alföld; Duna; Magyarország felfedezése sorozat,http://nektar.oszk.hu/hu/manifestation/623495,
Kunszabó Ferenc,Sárköz,308 MF K98,,Szépirodalmi,1972,szociológia; szociográfia; honismeret; Sárpilis; Magyarország felfedezése sorozat,http://nektar.oszk.hu/hu/manifestation/1322315,
László-Bencsik Sándor,Történelem alulnézetben,308 MF L29,,Szépirodalmi,1973,szociológia; szociográfia; ipar; munkásosztály; memoárok; Magyarország felfedezése sorozat,http://nektar.oszk.hu/hu/manifestation/1325079,
Lázár István,Kiált Patak vára,308 MF L37,,Szépirodalmi,1974,szociológia; szociográfia; Borsod-Abaúj-Zemplén megye; Hegyalja; Bodrogköz; Hegyköz; Zempléni-hegység; Sárospatak; Szerencs; Magyarország felfedezése sorozat,http://nektar.oszk.hu/hu/manifestation/1325542,
Mocsár Gábor,Égő arany,308 MF M76,,Szépirodalmi,1970,szociológia; szociográfia; kőolajtermelés; riportok; Magyarország felfedezése sorozat,http://nektar.oszk.hu/hu/manifestation/1057541,
Molnár Géza,Külvárosi barangolás,308 MF M80,,Szépirodalmi,1974,szociológia; szociográfia; Budapest; Pesterzsébet; Magyarország felfedezése sorozat,http://nektar.oszk.hu/hu/manifestation/1326881,
Tüskés Tibor,Nagyváros születik,308 MF T98,,Szépirodalmi,1975,szociológia; szociográfia; Pécs; Magyarország felfedezése sorozat,http://nektar.oszk.hu/hu/manifestation/1328099,
Varga Domokos,Erdőkerülőben,308 MF V37,,Szépirodalmi,1970,szociológia; szociográfia; erdőgazdálkodás; erdészet; vadgazdálkodás; vadászat; Magyarország felfedezése sorozat,http://nektar.oszk.hu/hu/manifestation/1059780,
Varga Domokos,Vizek könyve,308 MF V37,,Szépirodalmi,1976,szociológia; szociográfia; vízgazdálkodás; hajózás; halászat; ivóvízellátás; árvíz; belvíz; gyógyvíz; környezetvédelem; Duna; Tisza; Magyarország felfedezése sorozat,http://nektar.oszk.hu/hu/manifestation/623189,
Végh Antal,"Erdőháton, Nyíren",308 MF V65,,Szépirodalmi,1972,szociológia; szociográfia; Szabolcs-Szatmár megye; Nyírség; Magyarország felfedezése sorozat,http://nektar.oszk.hu/hu/manifestation/1323256,
Zám Tibor,Bács-Kiskunból jövök,308 MF Z22,,Szépirodalmi,1973,szociológia; szociográfia; Bács-Kiskun megye; Magyarország felfedezése sorozat,http://nektar.oszk.hu/hu/manifestation/1324144,
Patai József,"Középső kapu, A : egy kis gyermek és egy nagy könyv élete",308 P42,,Múlt és Jövő,1997,szociográfia; társadalomrajz; zsidóság; zsidó imádság; zsidó szertartás; zsidó vallás; judaizmus; Gyöngyöspata,http://nektar.oszk.hu/hu/manifestation/252434,
Sulyok Katalin,Indul a mezőny : riportok [pályakezdő fiatalokról],308 S96,,Kozmosz,1973,ifjúságszociológia; Magyarország; pályakezdés; riportok,http://nektar.oszk.hu/hu/manifestation/1266051,
,Szerelem jogán : riportok mai fiatalokról,308 Sz73,,Móra,1961,ifjúságszociológia; szociográfia,http://nektar.oszk.hu/hu/manifestation/1240308,
Végh Antal,"De mi lesz a harangokkal? : Erdély, 1988 : Útirajz",308 V65,,Művészeti Alap,1988,szociográfia; társadalomrajz; nemzetiségi kérdés; magyar kisebbség; Románia; útleírás,http://nektar.oszk.hu/hu/manifestation/529143,
Weis István,"Magyar falu, A",308 W41,,M. Szemle Társ.,1931,szociológia; szociográfia; településszerkezet; Magyarország,http://nektar.oszk.hu/hu/manifestation/3320148,
Korzenszky Richárd OSB - Somorjai Ádám OSB,Magyar sorskérdések : előadások a magyar kultúra és népesedés keresztény szempontjairól,310 K72,,Detti Ny.,1989,művelődéstörténet; keresztény társadalom; erkölcsteológia; morálteológia; kultúra; bioetika; abortusz; magyar egyháztörténet,http://nektar.oszk.hu/hu/manifestation/813518,
Kovács Judit,"Szaporodjatok és sokasodjatok... : népességbomba, születésszabályozás, családtervezés",310 K79,,Kossuth,1969,népességpolitika; demográfia,http://nektar.oszk.hu/hu/manifestation/1048213,
Karátson Endre - Neményi Ninon (szerk.),Belső tilalomfák : tanulmányok a társadalmi öncenzúráról ,316 B46,,Hollandiai Mikes Kelemen Kör,1982,szociálpszichológia; cenzúra; Magyarország; 1956-os forradalom; értelmiség; zsidóság,http://nektar.oszk.hu/hu/manifestation/1450980,
Bíró Béla,"Gyűlölet terhe, A : esszék, 1997-2000",316 B65,,Liget Műhely Alapítvány,2000,kisebbségek; magyar kisebbség; Románia; Erdély; identitás; Romániai Magyar Demokrata Szövetség; esszék,http://nektar.oszk.hu/hu/manifestation/453663,
Bokor Ágnes,Szegénység a mai Magyarországon,316 B75,,Magvető,1987,munkanélküliség,http://nektar.oszk.hu/hu/manifestation/621366,
Buda Béla,Elmélet és alkalmazás a mentálhigiénében : újabb tanulmányok a mentálhigiénés szemlélet és az elsődleges megelőzés témaköréből,316 B91,,Támasz Alapítvány - OAI,1998,család; iskola; tömegkommunikáció; alkoholizmus; pszichoterápia,http://nektar.oszk.hu/hu/manifestation/2877718,
Csaba György - Vörös László,Ma és holnap : bioszociális meditációk az ember jelenéről és jövőjéről,316 C33,,Medicina,1975,szociálbiológia; szociológia,http://nektar.oszk.hu/hu/manifestation/1327669,
Csepela Lajos,Keresztény szocziológia,316 C56,,Klein-Ludvig Ny.,1907,szociológia; vallásszociológia,http://nektar.oszk.hu/hu/manifestation/3098037,
Csepeli György,Nemzeti tudat és érzésvilág Magyarországon a 70-es években,316 C56,,Múzsák,1985,társadalomtörténet; szociálpszichológia; szociológia; magyarságtudat; nemzeti identitás,http://nektar.oszk.hu/hu/manifestation/705980,
Csepeli György,"Szociálpszichológia vázlata, A",316 C56,,NPI,1980,társadalomlélektan,http://nektar.oszk.hu/hu/manifestation/704728,
Rónainé F. Mária (szerk.),Bölcsőde : családdal a kisgyermekekért,316 CSPF B85,,Nk. Családév Titkársága,1994,gyermeknevelés; csecsemőgondozás; családpedagógia; kézikönyv; Családpolitikai füzetek sorozat,http://nektar.oszk.hu/hu/manifestation/131062,
"Kovács Imre, P. (szerk.)",Családok közelről : szociográfiák,316 CSPF C36,,Nk. Családév Titkársága,1994,szociológia; szociográfia; életmód; Magyarország; Erdély; Családpolitikai füzetek sorozat,http://nektar.oszk.hu/hu/manifestation/110035,
"Durkheim, Émile","Öngyilkosság, Az : szociológiai tanulmány",316 D98,,Osiris,2000,szociálpszichológia,http://nektar.oszk.hu/hu/manifestation/797028,
Eglis István,"Keresztény szociológia főbb kérdései, A",316 E21,,Actio Catholica,1948,vallásszociológia; egyház társadalmi tanítása; egyház és társadalom,http://nektar.oszk.hu/hu/manifestation/2973706,
Géczi János,"Vadnarancsok II. : Homoszexuálisok vallomásai, 1980-81",316 G33,,Magvető,1987,szociológia; homoszexualitás; Magyarország,http://nektar.oszk.hu/hu/manifestation/621164,
"Grusin, Borisz Andrejevics","Vélemények világa, A : a közvélemény-kutatás metodológiai problémái",316 G69,,Gondolat,1971,szociológia,http://nektar.oszk.hu/hu/manifestation/1262943,
Czike Klára - Tausz Katalin (szerk.),Gyorsjelentés a szegénységről,316 G84,,Szociális Szakmai Szövets.,1996,szociálpolitika; Magyarország,http://nektar.oszk.hu/hu/manifestation/212235,
"Habermas, Jürgen","Társadalmi nyilvánosság szerkezetváltozása, A : vizsgálódások a polgári társadalom egy kategóriájával kapcsolatban ",316 H10,,Gondolat,1971,politikai filozófia; politikatudomány; polgári társadalom; közvélemény,http://nektar.oszk.hu/hu/manifestation/1262751,
"Huntington, Samuel Phillips","Civilizációk összecsapása és a világrend átalakulása, A",316 H95,,Európa,2008,egyetemes történelem; történelemfilozófia; politikatudomány; társadalomelmélet; külpolitika,http://nektar.oszk.hu/hu/manifestation/2777073,
Illyés Gyula,Ki a magyar?,316 I39,,Mefhosz Kvk.,1939,magyarság; nemzeti karakter; nyelvtörténet; tanulmány,http://nektar.oszk.hu/hu/manifestation/3270372,
,Jelentés a gyerekek helyzetéről Magyarországon : 1992,316 J57,,Gyermekérdekek Mo. Fóruma,1993,szociográfia; gyermekvédelem; tanulmányok,http://nektar.oszk.hu/hu/manifestation/1010050,
,"Max Weber és a 20. század társadalomtudományi gondolkodása : Erdélyi Ágnes, Cs. Kiss Lajos, Erényi Tibor, Szigeti Péter és Somlai Péter írásai",316 M48,,Napvilág,1999,szociológia; Németország; tanulmányok,http://nektar.oszk.hu/hu/manifestation/351264,
Miskolczi Miklós,Mindenki mással csinálja és egyéb írások,316 M70,,IPV,1985,szociológia; szociográfia; házasságtörés; családi élet; erkölcs; Magyarország,http://nektar.oszk.hu/hu/manifestation/664220,
Miskolczi Miklós,"Szinlelni boldog szeretőt, hazudni boldog hitvest",316 M70,,IPV,1985,szociológia; szociográfia; párkapcsolat; család; házasságtörés; nemi erkölcs,http://nektar.oszk.hu/hu/manifestation/664246,
,"Rashajok, papok, szerzetesek : istenes emberek a cigányok között",316 R38,,Jézus Társasága Mo. Rendtartománya,2014,szerzetesség; jezsuita rend; Magyarország; misszió; kisebbségek; cigányság; cigány néprajz; cigánypasztoráció; vallásszociológia; Balázs József; Lakatos Péter; Somos László; Lankó József; Csonka Csaba; Gergely Dezső; Orsós Mózes; Gávodi Róbert; Popva Valér; interjúk,http://nektar.oszk.hu/hu/manifestation/3542622,
"Schivelbusch, Wolfgang",Írástudók alkonya : a frankfurti értelmiség a húszas években,316 S30,,Akadémiai,1994,német filozófia; szellemi élet,http://nektar.oszk.hu/hu/manifestation/77727,
Székely János,Cigány népismeret : te del o Del baxt!,316 Sz48,,Szt. István Társ.,2013,"kisebbségek; szociológia; romológia; cigányság; cigány néphagyományok; cigány nyelv; cigányellenesség; cigánykutatás; cigánykérdés; történelem; művészet; irodalom; életmód; misszió; Európa; Magyarország; Ceferino Jiménez Malla, B.",http://nektar.oszk.hu/hu/manifestation/3477439,
Szilágyi Gyula,Melegfront,316 Sz79,,M. Könyvklub,2002,szociológia; homoszexualitás; Magyarország; interjúk,http://nektar.oszk.hu/hu/manifestation/918739,
Arató Endre,"Magyarországi nemzetiségek nemzeti ideológiája, A",320 A79,,Akadémiai,1983,politikai ideológia; nemzetiségi kérdés; kisebbségek,http://nektar.oszk.hu/hu/manifestation/570240,
"Arendt, Hannah",Múlt és jövő között : nyolc gyakorlat a politikai gondolkodás terén,320 A81,,Readers Intern. - Osiris,1995,történelemfilozófia; politikai filozófia; politikaelmélet; tanulmányok,http://nektar.oszk.hu/hu/manifestation/163159,
Asbóth János,Magyar conservativ politika,320 A88,,Légrády,1875,magyar történelem; belpolitika; Magyarország; konzervativizmus,http://nektar.oszk.hu/hu/manifestation/3102310,
Balogh István,Vallás és egyház a mai Magyarországon,320 B24,,Kossuth,1974,egyház és állam; valláskritika,http://nektar.oszk.hu/hu/manifestation/1267625,
Barankovics István,Híven önmagunkhoz : Barankovics István összegyűjtött írásai a kereszténydemokráciáról,320 B29,,Barankovics Akad. Alapítvány,2001,eszmetörténet; belpolitika; kereszténydemokrácia; politikai párt; Demokrata Néppárt; Magyarország; politikus; életrajz; publicisztika; források; tanulmányok,http://nektar.oszk.hu/hu/manifestation/900417,
"Benoist, Alain de",Kommunizmus és nácizmus : gondolatok a XX. századi totalitarizmusokról,320 B51,,Europa Authentica,2000,kommunizmus; nemzetiszocializmus,http://nektar.oszk.hu/hu/manifestation/801718,
Bibó István,Demokratikus Magyarország : válogatás Bibó István tanulmányaiból,320 B62,,Magvető,1994,társadalomtörténet; demokrácia; tanulmányok,http://nektar.oszk.hu/hu/manifestation/76570,
Bolgár Elek,Válogatott tanulmányok,320 B76,,Akadémiai,1958,belpolitika; Magyarország,http://nektar.oszk.hu/hu/manifestation/1233054,
Csapó Endre,Ilyen a világ : az Ausztráliai Magyarságban és a Magyar Életben 1961-1983 között megjelent vezércikkek,320 C41,,Logos,2002,politikai kultúra; Magyarország; publicisztika,http://nektar.oszk.hu/hu/manifestation/1068319,
Czettler Jenő,Agrárpolitika,320 C94,,Magyar Szemle Társ.,1932,gazdaságtörténet; mezőgazdaság; birtokviszonyok; hitelpolitika; Magyarország,http://nektar.oszk.hu/hu/manifestation/3320654,
Dante Alighieri,"Egyeduralom, Az",320 D23,,Kossuth,2003,államelmélet; abszolutizmus; filozófia,http://nektar.oszk.hu/hu/manifestation/949475,
Debreczeni József,"Új miniszterelnök, Az",320 D36,,Osiris,20206,belpolitika; politikai párt; politikus; Magyarország; Gyurcsány Ferenc; életrajz,http://nektar.oszk.hu/hu/manifestation/2615994,
,"Egyházi kapcsolatok, 1998-2002",320 E30,,NKÖM Egyházi Kapcsolatok Titkársága,2002,egyházpolitika; egyház és állam; Magyarország,http://nektar.oszk.hu/hu/manifestation/930142,
Apró István (szerk.),Esélyek és remények a Kárpát-medencében,320 E93,,Euro-Hungaria Alapítvány,1992,Kárpát-medence; magyar kisebbség; határon túli magyarok; belpolitika; külpolitika; Ausztria; Románia; Csehszlovákia; Jugoszlávia; tanulmányok; Magyarság és Európa. Nemzetpolitikai szemle,http://nektar.oszk.hu/hu/manifestation/168687,
"Faguet, Émile","Kontárság kultusza, A",320 F12,,Kossuth,1994,politikai filozófia; államelmélet; társadalomkritika; demokrácia; Franciaország,http://nektar.oszk.hu/hu/manifestation/80056,
Fehérváry István,"Börtönvilág Magyarországon, 1945-1956",320 F35,,M. Pol. Foglyok Szövetsége,1990,magyar történelem; koncepciós perek; államvédelem; politikai rendőrség; politikai terror; börtönrendszer; börtönnapló,http://nektar.oszk.hu/hu/manifestation/556802,
,Félbemaradt reformkor : miért akadt el az ország keresztény humanista megújulása? : a Katolikus Szemlében megjelent tanulmányok gyűjteménye,320 F41,,Detti Ny.,1990,magyar történelem; belpolitika; társadalompolitika; egyház és állam; KALOT; népfőiskolák; EMSZO; KIOE; KALÁSZ; Magyar Parasztszövetség; Csehszlovákia; kereszténydemokrácia; Demokrata Néppárt; Kisgazdapárt; 1956-os forradalom; Közi Horváth József; Kerkai Jenő; Czupy Bálint; Hajdú-Németh Lajos; Kovrig Béla; Barankovics István; keresztény szakszervezetek; tanulmányok,http://nektar.oszk.hu/hu/manifestation/816136,
Fila Lajos,"Hatalom történelmi alkotmánya, A",320 F57,,s.n.,2007,morálteológia; erkölcsteológia; egyház és társadalom; egyház társadalmi tanítása; politológia; állam; magyar alkotmány; politikai filozófia; állami jog,http://nektar.oszk.hu/hu/manifestation/2714909,
Békés Gellért OSB - Horváth Árpád SJ (szerk.),"Földindulás Magyarországon? : nézetek és elemzések : 31. Magyar Pax Romana Kongresszus, 1989 március 27 - április 1, Reichenau - Németország",320 F83,,Katolikus Szemle,1989,belpolitika; egyház és állam; tanulmányok,http://nektar.oszk.hu/hu/manifestation/815683,
Franka Tibor,Most jöttem Erdélyből…,320 F91,,Láng,1988,"magyar történelem; Magyarország; menekültügy, emigráció; kivándorlás",http://nektar.oszk.hu/hu/manifestation/542063,
"Gandhi, Mohandas Karamchand","Erkölcsiség vallása, Az",320 G22,,Farkas L. I.,1998,történelem; India; hinduizmus; társadalmi etika; passzív ellenállás; gandhizmus; tanulmányok,http://nektar.oszk.hu/hu/manifestation/334297,
"Gandhi, Mohandas Karamchand",Gandhi Mahátmá válogatott írásai és beszédei,320 G22,,Athenaeum,1926,történelem; India; filozófia; hinduizmus; tanulmányok; beszédek,http://nektar.oszk.hu/hu/manifestation/1543050,
Győriványi Sándor,"Kisgazdapárt regénye a kezdetektől napjainkig, A",320 G93,,Útmutató K.,1995,magyar történelem; belpolitika; politikai párt; Független Kisgazdapárt,http://nektar.oszk.hu/hu/manifestation/159683,
Habsburg Ottó,Így láttam ... : 1990-1991-1992,320 H10,,Vörösváry,1992,Euurópa története; magyar történelem; rendszerváltás; külpolitika; európai integráció; memoár; tanulmányok,http://nektar.oszk.hu/hu/manifestation/820445,
"Hobson, John Atkinson","Új világ problémái, Egy",320 H72,,Athenaeum,1924,Európa története; politikai rendszer; gazdaság,http://nektar.oszk.hu/hu/manifestation/1543048,
Izsák Lajos,"Keresztény Demokrata Néppárt és a Demokrata Néppárt, 1944-1949, A",320 I99,,Kossuth,1985,magyar történelem; politikatörténet; politikai párt,http://nektar.oszk.hu/hu/manifestation/600686,
Szigeti Szabolcs - Frivaldszky János (szerk.),"Jó kormányzásról, A : elmélet és kihívások",320 J64,,JTMR Faludi F. Akad. - Jezsuita Európa Iroda - OCIPE Magyarország - L'Harmattan,2012,politikai filozófia; államelmélet; kormányzás elmélete; belpolitika; államigazgatás; közigazgatás; egyházak; egyház és állam; Magyarország,http://nektar.oszk.hu/hu/manifestation/3431768,
Kecskeméthy Aurél,Kákay Aranyos politikai társadalmi tragico-humoristicus krónikája,320 K29,,Ráth,1869,magyar irodalom; belpolitika; Magyarország; politikai élet; kormány; országgyűlés; parlament; esszék; karcolatok,http://nektar.oszk.hu/hu/manifestation/3032784,
Kende Péter,Erdélyből jöttek,320 K37,,ILK,1988,menekültügy; magyar kisebbség; Románia; nemzetiségi kérdés; passzív ellenállás; interjúk; riportok,http://nektar.oszk.hu/hu/manifestation/685919,
Actio Catholica Orsz. Elnöksége (közread.),Kereszténység és demokrácia,320 K40,,Szt. István Társ.,1946,egyház társadalmi tanítása; kereszténydemokrácia; közélet,http://nektar.oszk.hu/hu/manifestation/2948312,
Kereszténydemokrata Néppárt,"Keresztény út, A : A Kereszténydemokrata Néppárt programja : 100 pontos program",320 K40,,KDNP,1990,kereszténydemokrácia; politikai párt,http://nektar.oszk.hu/hu/manifestation/507043,
Koltay Gábor,"Bukaresti Trianon-vita, A",320 K66,,Szabad Tér,2005,magyar történelem; trianoni békeszerződés;belpolitika; nemzetiségi kérdés; dokumentumfilm; Románia; politikai kultúra,http://nektar.oszk.hu/hu/manifestation/2591805,
"Kornauer, Paul","Nagypéntek, feltámadás nélkül : egy túlélő visszaemlékezései a bácskai vérengzésekre, 1944-48",320 K71,,Szt. István Társ.,2011,történelem; II. világháború; Jugoszlávia; Vajdaság; politikai terror; kitelepítés; németek; memoár,http://nektar.oszk.hu/hu/manifestation/3383148,
,Kossuth Lajos műveiből,320 K73,,Franklin,1934,magyar történelem; politikatörténet; belpolitika; levelek; beszédek; publicisztika; források,http://nektar.oszk.hu/hu/manifestation/3210372,
Lajos Iván,"Horvát kérdés, A",320 L14,,Pécsi Irodalmi és Könyvnyomdai Rt.,1932,katolikus egyház; ortodox egyház; pánszerbizmus; délszláv eszme; fiumei rezolúció; magyar-horvát unió; kiegyezés; emigráció; Jugoszlávia; szerb hegemónia,http://nektar.oszk.hu/hu/manifestation/2966752,
Lakatos Pál,"Betonba döngölt Magyarország, A (A Magyar Rádió Vasárnapi Újság c. műsorában elhangzott interjúk)",320 L17,,Kairosz,2001,korrupció; Magyarország; rádióműsor,http://nektar.oszk.hu/hu/manifestation/805742,
Lántzky László - Szántó András,Felsőbb osztályba léphet?! : kereszténydemokrata gondolatok a politikáról és az ideológiáról,320 L26,,KDNP Józsefvár. Szerv.,1992,gazdaságpolitika; társadalompolitika; oktatáspolitika; politikai párt; Kereszténydemokrata Néppárt,http://nektar.oszk.hu/hu/manifestation/10714,
Latorcai János,"Szólni, tenni kell!",320 L34,,KDNP Országgyűlési Képviselőcsop.,2008,"politológia; magyar belpolitika; rendszerváltás; Magyarország; 
országgyűlési beszédek; KDNP",http://nektar.oszk.hu/hu/manifestation/2784968,
"Le Play, Frédéric","Munkásviszonyok reformja, A",320 L40,,Akadémia,1903,társadalomtörténet; társadalomfilozófia; jobbágyság; munkásosztály; társadalomrajz; Franciaország; társadalmi reform,http://nektar.oszk.hu/hu/manifestation/2931493,
"Lenin, Vlagyimir Iljics",Mi a teendő? : mozgalmunk égető kérdései : 1902,320 L53,,Szikra,1948,kommunista párt; Oroszország; Szovjetunió története; forrás; napló,http://nektar.oszk.hu/hu/manifestation/2967924,
Lovas Rezső - Náray-Szabó Gábor - Pálinkás József (szerk.),Szent István-terv : gondolatok a nemzet felemelkedéséről,320 L82,,Professzorok Batthyány Köre - M. Szemle Alapítvány,2005,gazdaságpolitika; gazdasági előrejelzés; futurológia; jövőkutatás; kultúrpolitika; felsőoktatás; fejlesztéspolitika; Magyarország,http://nektar.oszk.hu/hu/manifestation/2571058,
Lukács József,Vallás és vallásosság a mai Magyarországon : A hazai tudományos kutatások néhány eredménye,320 L92,,Kossuth,1987,marxizmus; szekularizáció; ateizmus; egyház és állam; egyház és szocializmus; valláskritika; egyházpolitika; párbeszéd,http://nektar.oszk.hu/hu/manifestation/601716,
"Machiavelli, Niccolo","Fejedelem, A",320 M10,,Kossuth,1996,történelemfilozófia; politikai filozófia; államelmélet; politikatudomány; hatalom; politika és erkölcs,http://nektar.oszk.hu/hu/manifestation/178488,
Hubai László - Tombor László (szerk.),"Magyar parlament, 1944-1949, A : Tanulmányok",320 M14,,Gulliver,1991,magyar történelem; jog; tanulmányok,http://nektar.oszk.hu/hu/manifestation/741753,
,Magyar Polgári Együttműködés a polgári Magyarországért : 1995. szeptember - 1998. június,320 M14,,Batthyány Alapítvány - M. Polgári Együttműködés,1998,politika; belpolitika; Magyarország; konferencia-kiadvány; tanulmányok,http://nektar.oszk.hu/hu/manifestation/326088,
Bokor Pál - Tábori András (szerk.),Magyarnak lenni : [A Magyar hírlap cikksorozata ... 1987. december 24-től 1988. április 2-ig],320 M16,,M. Hírlap Kv. - Zrínyi Ny.,1988,magyar kisebbség; emigráció; Kárpát-medence; nemzeti identitás; nemzettudat; interjúk; publicisztika,http://nektar.oszk.hu/hu/manifestation/542151,
Forgács Imre (szerk.),Magyarország a '90-es években : a magyar kormány válasza az Európai Unió kérdőívére : rövidített változat,320 M16,,Külügymin. - ISM,1997,társadalompolitika; gazdaságpolitika; művelődésügy; pénzügyek; statisztika,http://nektar.oszk.hu/hu/manifestation/238380,
Agócs Sándor - Medvigy Endre (szerk.),"Magyarság esélyei, A : a tanácskozás hiteles jegyzőkönyve : Lakitelek, 1987. szept. 27.",320 M18,,Püski,1991,belpolitika; Magyarország; Magyar Demokrata Fórum; rendszerváltás; források,http://nektar.oszk.hu/hu/manifestation/753003,
"Manent, Pierre",Politikai filozófia felnőtteknek : a demokratikus társadalom látlelete,320 M26,,Osiris,2003,politikatudomány; demokrácia,http://nektar.oszk.hu/hu/manifestation/969180,
Mocsáry Lajos,Nemzetiség,320 M72,,Ráth,1858,belpolitika; nemzetiségi kérdés; szlávok; pánszlávizmus,http://nektar.oszk.hu/hu/manifestation/3229641,
Molnár Tamás,"Atlanti kultúra kibontakozása, Az",320 M83,,Kairosz,2006,civilizáció; külpolitika; Európa; Észak-Amerika; USA,http://nektar.oszk.hu/hu/manifestation/2634027,
Molnár Tamás,"Hatalom két arca, A: politikum és szentség",320 M83,,Európa,1992,politológia; államelmélet; történelemfilozófia; etika; vallásszociológia; egyház és állam; hatalom,http://nektar.oszk.hu/hu/manifestation/16987,
