szerzo,cim,jelzet,raktar,kiado,ev,targyszavak,kulso_leiras,megjegyzesek
Hetény János,Gyönyörű nagy vonzalom... : a Karancs-hegyi kistáj Mária-kultuszt ihlető szerepe ,248 H65,,SZTE Néprajzi és Kult. Antropológia Tansz.,2006,vallási néprajz; népi vallásosság; Mária-tisztelet; Mária-ünnep; kultusz; Magyarország; Karancs-vidék; tanulmányok,http://nektar.oszk.hu/hu/manifestation/2643387,
Hetény János,"Győri vérrel könnyező Szűzanya kultusztörténete, A",248 H65,,JATE Néprajzi Tansz.,2000,Szűz Mária; Mária-tisztelet; Mária-kultusz; kegykép; búcsú; Walter Lynch,http://nektar.oszk.hu/hu/manifestation/431712,
Hildegard von Bingen,"Megváltás tüzes műve, A",248 H70,,Balassi - BAE Tartóshullám,1995,misztika; Szentháromság; vallásos irodalom,http://nektar.oszk.hu/hu/manifestation/125258,
Horváth Atanáz OFM,"Boldogasszonyi kegyhely története, A",248 H84,,szerző,1926,magyar egyháztörténet; búcsújárás; zarándokhelyek; Frauenkirchen; Ausztria; Esterházy Pál; Mária-kegyhely; Mária-tisztelet; ferences rend,http://nektar.oszk.hu/hu/manifestation/3156605,
Kállay Kotász Zoltán - Báti Márk Teofán OSBM (szerk.),Igaz beszéd a második pócsi Szűz Szent Mária képének sírása és könnyezése felől azaz: amely mostan közönséges tiszteletre kitétetvén nemes Szabolcs vármegye Pócs helységében Magyar Országban tiszteltetik,248 I15,,Máriapócsi Bazilita Monostor,2015,Máriapócs; kegykép; csoda; Mária-tisztelet,http://nektar.oszk.hu/hu/manifestation/3628329,
Ignatius de Loyola (Loyolai Szt Ignác),Loyolai Szent Ignác lelkigyakorlatos könyve,248 I20,,Szt. István Társ.,1986,lelkigyakorlat,http://nektar.oszk.hu/hu/manifestation/673265,
"Johnston, Francis","Guadalupei Szűzanya jelenései, A : a guadalupei csoda története",248 J67,,Christianus,1993,Szűz Mária; Mária-jelenés; Mária-tisztelet; ,http://nektar.oszk.hu/hu/manifestation/79114,
Kákonyi Asztrik OFM,Elmélkedések a rózsafüzér titkairól : Máriával Jézushoz,248 K11,,Kapisztrán Szent Jánosról nevezett Ferences Tartományfőnökség,1991,lelkigyakorlat,http://nektar.oszk.hu/hu/manifestation/3563193,
Katona István,"Úr arca előtt, Az! 1-2. köt.",248 K25,,Marana Tha 2000 Alapítvány,1996-1997,imaélet,http://nektar.oszk.hu/hu/manifestation/213756,
Bábel Balázs et al. (összeáll.),"Keresztény spiritualitás története és a lelki élet teológiai alapjai , A",248 K40,,Közp. Papnevelő Int.,1994,hitélet; lelki élet; spirituális teológia; misztika története; kegyelem; valláspszichológia,http://nektar.oszk.hu/hu/manifestation/3471607,
Láng Siegfried,"Magyarság öt-seb titka, A : a keresztény magyarság önazonossága, Mária tulajdonának és örökségének öt hivatása és feladata",248 L24,,Stella Maris Alapítvány,2008,magyar történelem; kereszténység; Regnum Marianum,http://nektar.oszk.hu/hu/manifestation/2874848,
"Laplace, Jean","Lélek műhelyében, A : tíz napos lelkigyakorlat",248 L28,,Prugg,1980,aszketika; megtérés; Jézus-ima; Szűz Mária; szellemek megkülönböztetése; Eucharisztia; passió,http://nektar.oszk.hu/hu/manifestation/1447484,
"Laun, Hellmut",Találkoztam Istennel : egy századunkat jellemző megtérés története,248 L34,,Budapest-törökőri Lisieux-i Szent Teréz Plébánia,1995,konvertita,http://nektar.oszk.hu/hu/manifestation/166590,
"Lehodey, Vital OCist (után átdolg. Müller Lajos)",Isten kezében,248 L44,,Korda,1935,spirituális teológia; aszketika; lelki élet,http://nektar.oszk.hu/hu/manifestation/1563061,
Lénárd Ödön Piar,Mécs : a mai keresztény közösségi gondjai ,248 L47,,Márton Áron K.,1996,hitélet; kereszténység és közélet,http://nektar.oszk.hu/hu/manifestation/204484,
Lénárd Ödön Piar,Só : a mai keresztény egyéni gondjai : [keresztény magatartás],248 L47,,Márton Áron K.,1994,keresztény etika; erények; vallásosság,http://nektar.oszk.hu/hu/manifestation/145773,
Lénárd Ödön Piar,Só és mécs : a mai keresztény krisztusi lelkülete : [keresztény magatartás],248 L47,,Márton Áron K.,1996,keresztény etika,http://nektar.oszk.hu/hu/manifestation/229152,
"Longo, Bartolo, B.","Pompeji Rózsafüzér Királynője kegytemplom története, A",248 L78,,Szt. István Társ.,2008,kegyhely; Mária-tisztelet; templomépítészet,http://nektar.oszk.hu/hu/manifestation/2823730,
"Louf, André",Bennünk a lélek imádkozik,248 L81,,Opus Mystici Corporis,1979,spirituális teológia; imádság; imaélet,http://nektar.oszk.hu/hu/manifestation/1356463,
"Marmion, Columba OSB","Krisztus, a lélek élete : lelkigyakorlatok",248 M35,,Szt. István Társ.,1939,krisztológia; Jézus Krisztus; elmélkedés,http://nektar.oszk.hu/hu/manifestation/1586662,
Marton Marcell OCD,"Tíz nap Isten előtt : Marcell atya lelkigyakorlata Attyapusztán, 1955. június 6-15.",248 M37,,M. Sarutlan Kármelita Rendtartomány - Szt. Gellért,2008,kármelita rend,http://nektar.oszk.hu/hu/manifestation/2794764,
"Balthasar, Hans Urs von","Keresztény elmélkedés, A",248 M50,,Vigilia,1987,meditáció; vallásfilozófia,http://nektar.oszk.hu/hu/manifestation/540142,
,"Megnemismert felhője, A - A titkos tanácsok könyve",248 M50,,Vigilia,1987,angol irodalom; misztika; istenkeresés; hitélet; középkor,http://nektar.oszk.hu/hu/manifestation/540142,
"Menendez, Jozefa Maria",Szeretet-szózat : Jozefa Mária Menendez irataiból,248 M53,,Veritas,1944,misztika; Jézus Szíve-tisztelet; lelki irodalom,http://nektar.oszk.hu/hu/manifestation/2943765,
"Moore, Joseph",Így lesz barátom Jézus,248 M85,,Opus Mystici Corporis,1987,szentségek; személyes vallásosság; lelkiismeretvizsgálat; keresztény nevelés; lelki élet; imádság; érték; szenvedés; erkölcsteológia; fiatalok pasztorációja; lelkigyakorlatos kézikönyv,http://nektar.oszk.hu/hu/manifestation/810001,
"Müller, Paul",Szenvedéssel formál a Mester,248 M99,,Evangéliumi Kiadó,1980,spirituális teológia; betegség; lelkigondozás,http://nektar.oszk.hu/hu/manifestation/1395666,
Naszályi Emil OCist,Törekedjünk fölfelé! : útmutatás az Istennel egyesült életre,248 N36,,Márton Áron K.,1997,lelki irodalom,http://nektar.oszk.hu/hu/manifestation/241000,
Nogáll János,Keresztény hitélet csarnoka,248 N78,,Tichy Ny.,1862,imádság; elmélkedés; lelkiismeret; szentségek; gyónás; Oltáriszentség; Eucharisztia; Szűz Mária; Mária-tisztelet,http://nektar.oszk.hu/hu/manifestation/3247746,
"Sigal, Pierre André",Isten vándorai : Középkori zarándoklatok és zarándokok,248 S56,,Gondolat,1989,egyháztörténet; művelődéstörténet; Európa; búcsújárás; zarándokhelyek; peregrináció; szentév; vezeklés; ereklyekultusz; zarándokjelvény; Jeruzsálem; Róma; Santiago de Compostela; Tours; Monte Gargano; Mont-Saint-Michel; Mária-tisztelet; Mária-kultusz,http://nektar.oszk.hu/hu/manifestation/660965,
"Stolz, Alban",Mi Atyánk,248 S92,,Lepsényi,1889,Miatyánk; imádság; valláserkölcs; Tízparancsolat; bűn; gyónás,http://nektar.oszk.hu/hu/manifestation/3118481,
Valentiny Géza - Török Jenő (szerk.),Szentévi útravaló,248 Sz62,,Opus Mystici Corporis,1975,pasztorálteológia; lelkiismeretvizsgálat; liturgia; ima; elmélkedés,http://nektar.oszk.hu/hu/manifestation/1356031,
Szenthelyi-Molnár István,"Boldogságos Szűz Mária kegyhelyei Magyarországon, A",248 Sz63,,Szt. István Társ.,1971,búcsújárás; kegyhelyek; zarándokhelyek; Mária-tisztelet,http://nektar.oszk.hu/hu/manifestation/1208357,
"Tanquerey, Adolphe SS","Tökéletes élet, A : aszkétika és misztika 1-2. köt.",248 T28,,Salvatoris,2000,spirituális teológia; aszketika; misztika; hasonmás kiadás,http://nektar.oszk.hu/hu/manifestation/444927,
Tariczky Mária,"Hogyan tovább, Jézusom?",248 T30,,Szt. Gellért,2000,imakönyv,http://nektar.oszk.hu/hu/manifestation/448936,
Teres Ágoston SJ,Nagy jel az égen : az újjáéledő Rózsafüzér : új meditációk II. János Pál pápa apostoli leveléhez,248 T44,,Korda,2004,lelkigyakorlat; Rosarium Virginis Mariae,http://nektar.oszk.hu/hu/manifestation/2527875,
Teresa de Jesus (Avilai Szt Teréz),"Tökéletesség útja, A; A belső várkastély",248 T44,,Szt. István Társ.,1979,spanyol irodalom; aszketika; misztika; kármelita rend,http://nektar.oszk.hu/hu/manifestation/672983,
Tommaso d'Aquino (Aquinói Szt Tamás),"Előadások a Hiszekegyről, a Miatyánkról és a Tízparancsolatról - A Hiszekegy és a szentségek; Miatyánk, Üdvözlégy; A tízparancsolat",248 T64,,Seneca,1994,skolasztikus filozófia; skolasztikus teológia; tomizmus; erkölcsteológia; apostoli hitvallás,http://nektar.oszk.hu/hu/manifestation/98339,
Tóth Mike Mihály SJ,Hajdan és most : Jézus Szent Szívének tisztelete Magyarországon,248 T77,,Hornyánszky,1898,magyar egyháztörténet; Jézus Szíve-tisztelet; ,http://nektar.oszk.hu/hu/manifestation/3052697,
Tóth Tihamér,Christus en de jongen [Krisztus és az ifjú holland nyelven],248 T79,,De Vlaamsche Drukkerij,1933,erkölcsteológia; pedagógia; fiatalok pasztorációja; vallásos nevelés; jellemnevelés; ifjúsági irodalom,http://nektar.oszk.hu/hu/manifestation/1567574,
Tóth Tihamér,Kristus a mládež [Krisztus és az ifjú cseh nyelven],248 T79,,Skolské Sestry O. S. F.,1934,erkölcsteológia; pedagógia; fiatalok pasztorációja; vallásos nevelés; jellemnevelés; ifjúsági irodalom,http://nektar.oszk.hu/hu/manifestation/1567573,
"Vanier, Jean","Könnyek forrása, A : lelkigyakorlatos elmélkedések a szövetségről",248 V31,,Új Ember,2003,hitélet,http://nektar.oszk.hu/hu/manifestation/950114,
Varga Damján,"Két belga Lourdes: Beauraing, Banneux",248 V37,,Maurinum,1933,Mária-jelenés; Mária-kultusz; Mária-kegyhely,http://nektar.oszk.hu/hu/manifestation/2983008,
Varga Géza Ernő,Makkos Mária ősrégi bucsújáróhely rövid története,248 V38,,szerző,1945,búcsújárás; kegyhelyek; zarándokhelyek; Mária-tisztelet; Budakeszi,http://nektar.oszk.hu/hu/manifestation/3225906,
Verebélyi J. Pál,Üdvözlégy Mária : Keresztények segítsége : Elmélkedések a szentolvasóról,248 V68,,Ecclesia,1987,Szűz Mária; Mária-tisztelet; rózsafüzér; imádság,http://nektar.oszk.hu/hu/manifestation/673999,
Kozma György (szerk.),"Zarándokkönyv : Lelkiolvasmányok, imák, énekek",248 Z24,,Opus Mystici Corporis,1988,lelki élet; zarándokhelyek; imakönyv,http://nektar.oszk.hu/hu/manifestation/812661,
Zborovszky Ferenc SJ,Isten felé : háromnapos lelkigyakorlat,248 Z27,,Szív,1928,aszketika,http://nektar.oszk.hu/hu/manifestation/1543135,
"Zola, Salvatore Luigi - Ullathorne, William Bernard (alapján Jurcsó Antal)","Nagy világcsapás, A",248 Z58,,Hornyánszky Ny.,1925,Mária-jelenés; La Salette; jövendölés,http://nektar.oszk.hu/hu/manifestation/3198303,
Schüch Ignác,"Lelkipásztorkodástan kézikönyve, A",250 S40,R,Hunyadi Mátyás,1876,pasztorálteológia,http://nektar.oszk.hu/hu/manifestation/3208396,
Raátz Judit - Tóth Etelka (szerk.),"Egyházi retorika, Az : ""A retorika a társadalomban - a társadalom a retorikában"" konferencia előadásai és a tizennegyedik országos Kossuth-szónokverseny beszédei",251 E30,,ELTE BTK Mai Magyar Nyelvi Tansz.,2013,beszéd; kommunikáció; ; egyházi szónoklattan; szónoklásverseny; konferencia-kiadvány,http://nektar.oszk.hu/hu/manifestation/3491955,
"Zerfass, Rolf",Nevedet hirdetem : a homiletika alapelemei,251 Z43,,Szt. István Társ.,1995,egyházi szónoklattan; szentbeszéd; igehirdetés; tankönyv,http://nektar.oszk.hu/hu/manifestation/163984,
Bálint József SJ,"Párbeszéd küldetésében, A : népmissziós beszédek keresztény hitünk alapigazságairól a zsinati korszakban : papoknak, lelkipásztori munkatársaknak segédkönyv, világi híveknek lelki olvasmány",252 B20,,Agapé,1995,pasztorálteológia; kateketika; homiletika; segédkönyv; Vatikáni Zsinat,http://nektar.oszk.hu/hu/manifestation/141328,
Bánk József,Igére vár a nép : Gondolatok és buzdítások vasárnapokra és ünnepekre 1-3. köt.,252 B28,,Szt. István Társ.,1984-1989,homiletika; szentbeszédek,http://nektar.oszk.hu/hu/manifestation/673193,
Bánk József,"Vasárnapok, ünnepnapok : gondolatok és buzdítások az egyházi év vasárnapjaira és ünnepeire",252 B28,,Szt. István Társ.,1967,homiletika; szentbeszédek; ünnepek,http://nektar.oszk.hu/hu/manifestation/1054205,
Barsi Balázs OFM,Adventtől pünkösdig : konferenciabeszédek a pesti ferenceseknél az 1994-es egyházi évben,252 B35,,EFO,1994,homiletika; elmélkedés; ünnepek,http://nektar.oszk.hu/hu/manifestation/156160,
Bartakovics Béla,"Főpásztori levelek és szentbeszédek, melyeket egyházmegyéje papságához és híveihez intézett ... kis-apponyi Bartakovics Béla",252 B36,,Érseki Lyc. Ny.,1865,homiletika; egri érsekség,http://nektar.oszk.hu/hu/manifestation/3180952,
Belon Gellért,Ellesett pillanatok : Evangéliumi elmélkedések,252 B46,,Szt. István Társ.,1986,homiletika; szentbeszdek; lelki irodalom,http://nektar.oszk.hu/hu/manifestation/673177,
Benyik György,Igéző olvasmányok : elmélkedések a liturgikus év B ciklusának olvasmányairól,252 B51,,Agapé,2014,homiletika; szentbeszédek; szentmise; biblikum,http://nektar.oszk.hu/hu/manifestation/3580341,
Bitskey István,Humanista erudíció és barokk világkép : Pázmány Péter prédikációi,252 B68,,Akadémiai,1979,irodalomtörténet; művelődéstörténet; Magyarország; egyház és kultúra; humanizmus; ellenreformáció; igehirdetés; homiletika; szentbeszédek,http://nektar.oszk.hu/hu/manifestation/562956,
"Boulad, Henri SJ",Isten misztériuma : válogatott szentbeszédek,252 B84,,Korda,2010,homiletika,http://nektar.oszk.hu/hu/manifestation/3134325,
"Boulad, Henri SJ","Keresztény Isten botránya, A : angol nyelvű előadások",252 B84,,Korda,1998,homiletika; szentbeszédek,http://nektar.oszk.hu/hu/manifestation/303311,
Csanád Béla et al.,Vasárnapi elmélkedések : Liturgikus elmélkedések az egyházi év vasárnapjaira és ünnepeire a hároméves perikóparend szerint,252 C38,,Ecclesia,1981,homiletika,http://nektar.oszk.hu/hu/manifestation/673980,
Cserháti Ferenc,Szentleckekísérő : homíliák a vasárnapi szentleckék A-B-C sorozata alapján,252 C59,,Szt. István Társ.,2004,homiletika; szentbeszédek,http://nektar.oszk.hu/hu/manifestation/2543822,
Cserháti Ferenc,Ünnepszemle,252 C59,,Szt. István Társ.,1996,homiletika; szentbeszédek; egyházi év; ünnepek,http://nektar.oszk.hu/hu/manifestation/184706,
Csőgl János,Igehirdetésünk a szentmisében : Homilia vázlatok,252 C82,,Szt. István Társ.,1977,homiletika,http://nektar.oszk.hu/hu/manifestation/672947,
Diós István,Napi kenyerünk : hamvazószerdától nagypéntekig,252 D67,,Szt. István Társ.,2002,homiletika; szetbeszédek; nagyböjt,http://nektar.oszk.hu/hu/manifestation/921728,
Diós István,Napi kenyerünk : hamvazószerdától nagypéntekig,252 D67,,Szt. István Társ.,2002,homiletika; szentbeszédek; nagyböjt,http://nektar.oszk.hu/hu/manifestation/921728,
Ervin Gábor,"Veni sancte, Te Deum : rövid szentbeszédek",252 E92,,Korda,1940,homiletika,http://nektar.oszk.hu/hu/manifestation/1589581,
Jakubinyi György,Hirdesd az igét! : gondolatok a vasárnapi és ünnepnapi szentírási szakaszokhoz,252 J21,,Szt. István Társ.,2005,homiletika; igehirdetés; egyházi év,http://nektar.oszk.hu/hu/manifestation/2582313,
Kisfalusi János,"Úr Jézus és az Istenanyja ünnepei, Az",252 K51,,szerző,2001,homiletika; szentbeszédek,http://nektar.oszk.hu/hu/manifestation/909440,
Kovács Lajos Bánk OFM,"Gyertek, hallgassátok! : elmélkedések Bánk atyával a Szentírásról",252 K80,,PrintPix Ny.,2011,homiletika; szentbeszédek; bibliamagyarázat; egzegézis,http://nektar.oszk.hu/hu/manifestation/3346222,
Kovács Lajos Bánk OFM,"Gyertek, hallgassátok! : elmélkedések Bánk atyával a Szentírásról 2.",252 K80,,Kovács L. B.,2012,homiletika; szentbeszédek; bibliamagyarázat; egzegézis,http://nektar.oszk.hu/hu/manifestation/3424346,
Kovács Lajos Bánk OFM,Szentírási elmélkedések,252 K80,,szerző,2006,homiletika; szentbeszédek; Biblia; egyházi év,http://nektar.oszk.hu/hu/manifestation/2641193,
Magdics Ignác,Krisztus Világossága : szentbeszédek vagy olvasmányok az egyházi év vasárnapjaira és ünnepeire az eucharisztikus szentév alkalmából,252 M13,,Korda,1937,homiletika,http://nektar.oszk.hu/hu/manifestation/3400187,1-2. köt.
Márton Áron,Karácsony,252 M37,,Mentor,2010,homiletika; szentbeszédek,http://nektar.oszk.hu/hu/manifestation/3351764,
Mayer Béla,Újabb alkalmi beszédek és értekezések,252 M48,,Werner,1902,homiletika; szentbeszédek,http://nektar.oszk.hu/hu/manifestation/3096855,
"Melcher, Alois",Hitelemző beszédek 1-3. köt.,252 M52,,"Bába Ny., Szeged",1893,homiletika; szentbeszédek; hit; parancsok; kegyelem; szentségek,http://nektar.oszk.hu/hu/manifestation/3205879,
Mindszenty József,"Egyházam és hazám : Mindszenty József hercegprímás szentbeszédei 1. köt. 1945-1946, 2. köt. 1947, 3. köt. 1948",252 M69,,Esztergomi Főegyházm. - Bp. Hitokt. Felügyelőség,1991-1998,magyar egyháztörténet; egyházpolitika; állam és egyház; szentbeszédek,http://nektar.oszk.hu/hu/manifestation/116287,
Mindszenty József,Hirdettem az Igét : válogatott szentbeszédek és körlevelek : 1944-1975,252 M69,,Mindszenty Alapítvány,1982,Mindszenty József; magyar egyháztörténet;homiletika; lelkipásztorkodás; életrajz,http://nektar.oszk.hu/hu/manifestation/1450981,
"Ratzinger, Joseph","Mustármag reménye, A : Beszédek, elmélkedések, pásztorlevelek",252 R41,,Prugg,1979,szentbeszédek; vallásos irodalom; elmélkedések,http://nektar.oszk.hu/hu/manifestation/1445819,
Ruschek Antal,"Olajfák hegyétől a Golgotáig, Az : nagyböjti szentbeszédek...",252 R97,,Stephaneum Ny.,1904,homiletika,http://nektar.oszk.hu/hu/manifestation/3208756,
Serédi Jusztinián OSB,"Sollemnis oratio, quam occasione 900. anniversarii glorificationis S. Emerici ducis = Ünnepi beszéd Szent Imre herceg 900 éves jubileumi alkalmából",252 S51,,Buzárovits Ny. ,1930,homiletika; szentek élete; magyar szentek; Szt Imre,http://nektar.oszk.hu/hu/manifestation/1570187,
Seregély István,Jézus Krisztus az élet és a szentség forrása : ádventi és karácsonyi gondolatok évtizedek igehirdetésében,252 S51,,Szt. István Társ.,2006,"homiletika; szentbeszédek, ünnepek",http://nektar.oszk.hu/hu/manifestation/2643376,
Szivós Donát OSB,"Ma diákja, A : ifjúsági szentbeszédek",252 Sz85,,Szt. István Társ.,1936,homiletika; szentbeszédek ,http://nektar.oszk.hu/hu/manifestation/1547097,
,"Szüzanya találkozása a Szentlélekkel, A : szentbeszédsorozat",252 Sz99,,Prugg,1975,homiletika; Szűz Mária,http://nektar.oszk.hu/hu/manifestation/2616162,
Temesvári Pelbárt OFM,Temesvári Pelbárt válogatott írásai,252 T42,,Európa - Helikon,1982,középkori latin irodalom; homiletika; szentbeszédek; ferences rend,http://nektar.oszk.hu/hu/manifestation/639342,
Tóth Tibor,Új életsíkon : szentbeszédek leányok részére,252 T79,,Korda,1942,homiletika,http://nektar.oszk.hu/hu/manifestation/2756641,
Tóth Tihamér,Szentbeszédek a tízparancsolatról : a budapesti Pázmány-egyetem templomában az 1927.-28. tanévben elmondotta Tóth Tihamér 1-2. köt.,252 T79,,szerző,1929,homiletika,http://nektar.oszk.hu/hu/manifestation/3206599,
Turmezei Ferenc,Liturgikus gyermekszentbeszédek elemisták számára,252 T95,,Korda Rt.,1944,homiletika; szentbeszédek; liturgia,http://nektar.oszk.hu/hu/manifestation/2853267,
Vecsey József,"Szószék üzenete, A : rádióbeszédek",252 V63,,Ledermüller Ny.,1956,egyház és állam; katolikus egyház; dogmatika; krisztológia; antropológia; Egyház; magyarság; Szűz Mária; magyar szentek; emigráció; rádióműsor,http://nektar.oszk.hu/hu/manifestation/1373234,
Walter János,Napsugarak a newcasteli kőszéntelepen : gondolatok az év vasárnapjainak és az Úr ünnepeinek szentírási szakaszaihoz,252 W24,,Korda,1947,egyházi év; bibliamagyarázat; egzegézis; szentbeszédek,http://nektar.oszk.hu/hu/manifestation/2953695,
Wolkenberg Alajos,Missziós előadások és szentbeszédek vademecuma,252 W93,,Szt. István Társ.,1931,homiletika,http://nektar.oszk.hu/hu/manifestation/1597203,
Ajtai Kálmán,Katholikus iránytű : hogyan viselkedjünk a templomban és a szentségek felvételénél?,253 A30,,Kapisztrán Ny.,1941,pasztorálteológia,http://nektar.oszk.hu/hu/manifestation/1610220,
Balás Béla,"Első plébániám, Az : segítség kezdő papoknak",253 B16,,Márton Áron K. - OLI,2004,"lelkipásztorkodás;
pasztorálteológia; papi hivatás; segédkönyv; papság; plébánia",http://nektar.oszk.hu/hu/manifestation/2542018,
"Bérulle, Pierre de","Lelkivezetésről, A",253 B57,,Korda,1937,lelkipásztorkodás; pasztorálteológia; lelkigondozás,http://nektar.oszk.hu/hu/manifestation/1561892,
Csanád Béla,Misztérium és megújulás : pasztorálteológiai tanulmány a zsinati pasztorális reformok liturgiai megalapozásáról : jegyzet a lelkipásztorkodástani előadásokhoz,253 C38,,Tempó,1970,II. Vatikáni Zsinat; liturgikus reform,http://nektar.oszk.hu/hu/manifestation/1260512,
Faághy Richárd,"Öregkor reménysége, Az : levelek öreg barátaimnak - az élet dolgairól",253 F10,,Szt. Gellért,1999,lelkipásztorkodás; pasztorálteológia; szenvedés; öregedés; idősek; halál; pszichológia,http://nektar.oszk.hu/hu/manifestation/350749,
"Gots, Anton OSCam (Gots Antal)","Igen, Uram! : Ha embertársad haldoklik",253 G55,,Prugg,1982,szeretetszolgálat; betegség; halál; pasztorálteológia; betegek lelkigondozása; elmélkedés,http://nektar.oszk.hu/hu/manifestation/2616160,
"Gots, Anton OSCam (Gots Antal)",Isten az orvosom,253 G55,,Vigilia,1996,kamilliánus rend; lelkiség; segítségnyújtás,http://nektar.oszk.hu/hu/manifestation/230369,
"Gots, Anton OSCam (Gots Antal)",Szenvedésemet örömre váltottad : az öregkor bölcsessége,253 G55,,Vigilia,1998,kamilliánus rend; Ausztria; spirituális teológia; idősek; öregedés; keresztény hitélet; lelkigondozás; elmélkedés,http://nektar.oszk.hu/hu/manifestation/287895,
György Attila,Hazafelé : lelkipásztori napló,253 G90,,Sashalmi Egyházközség,1996,memoár,http://nektar.oszk.hu/hu/manifestation/3543305,
Jálics Ferenc SJ,Testvéreink hite,253 J23,,Prugg,1979,pasztorálteológia; lelkigondozás; lelkivezetés; lelkipásztorkodás,http://nektar.oszk.hu/hu/manifestation/1444899,
Tomka Ferenc (szerk.),"Krisztusi közösség a plébánián? : Lelkipásztori (teológiai) Napok : Eger, 1996. I. 29-31.",253 K95,,OLI,1996,pasztorálteológia; lelkipásztorkodás; plébánia; papok; világiak,http://nektar.oszk.hu/hu/manifestation/191702,
,Lelkipásztori munka : a második Érdi Papi Tábor előadásai és megbeszélései : 1941. június 24-28.,253 L46,,Stephaneum Ny.,1941,lelkipásztorkodás; papi élet; önképzés,http://nektar.oszk.hu/hu/manifestation/1611965,
"Liégé, Pierre-André",Tanúim lesztek,253 L65,,Opus Mystici Corporis,1970,lelkipásztorkodás; keresztény élet; hitoktatás; kateketika; morálteológia,http://nektar.oszk.hu/hu/manifestation/1430039,
"Lubich, Chiara",Ami odafönt van,253 L89,,Új Város [!Kék Világ Alapítvány],1994,pasztorálteológia; lelkipásztorkodás; lelkiségi mozgalmak; Fokoláre Mozgalom; vallási mozgalmak; szeretet; elmélkedés,http://nektar.oszk.hu/hu/manifestation/122828,
"Merton, Thomas OCSO",Lelkivezetés és elmélkedés,253 M55,,Prugg,1974,spirituális teológia; pasztorálteológia; lelki élet,http://nektar.oszk.hu/hu/manifestation/1437061,
"Merton, Thomas OCSO",Lelkivezetés és elmélkedés,253 M55,,Márton Áron K.,1989,lelkipásztorkodás; lelkigondozás,http://nektar.oszk.hu/hu/manifestation/3486457,
Palánkay Gausz Tibor SJ,Szeretetből nőtt egyházközség,253 P14,,Szt. Gellért,1995,közösség és személy; barátság; család; szolidaritás; családközösségek,http://nektar.oszk.hu/hu/manifestation/147930,
Mihalovics Zsigmond (összeáll.),Pro ara et focis : az 1942. június 30. és július 1-2. tartott lelkipásztori konferencia anyaga a családmentés lelkipásztori feladatairól,253 P92,,Actio Catholica Orsz. Elnökség,1942,pasztorálteológia; lelkipásztorkodás; családpasztoráció; konferencia-kiadvány,http://nektar.oszk.hu/hu/manifestation/2801088,
"Sexton, Jerry (alapján összeáll. Kozma György﻿)","Házaspárok Hétvégéje (Marriage Encounter) mozgalom, A",253 S52,,Opus Mystici Corporis,1987,lelkiségi mozgalmak; Házas Hétvége; lelkipásztorkodás; család; házasság,http://nektar.oszk.hu/hu/manifestation/810015,
Szentmártoni Mihály,Lelkipásztori pszichológia,253 Sz67,,Jel,1997,lelkipásztorkodás; antropológia; tanácsadás; segítő beszélgetés; lelkivezetés; szentségek; gyónás; lelkiismeret; szenvedés; halál; felsőoktatási tankönyv,http://nektar.oszk.hu/hu/manifestation/245308,
Teleki Béla,Lüktető élet : családi alapközösségek kézikönyve,253 T40,,Prugg,1989,pasztorálteológia; lelkipásztorkodás; családpedagógia; családi nevelés,http://nektar.oszk.hu/hu/manifestation/813070,
Teleki Béla,Viruló életért : családlelkipásztorkodási vázlatok,253 T40,,Prugg,1988,pasztorálteológia; lelkipásztorkodás; családpasztoráció,http://nektar.oszk.hu/hu/manifestation/811669,
Tomka Ferenc,Új evangelizáció : egyházunk helyzete és feladatai az ezredfordulón 2. köt.,253 T63,,,1999,pasztorálteológia; lelkipásztorkodás; plébánia; papság; világiak; szerzetesség; felnőttképzés; felsőoktatási tankönyv,http://nektar.oszk.hu/hu/manifestation/356840,
Tóth Tihamér,Jugendseelsorge [Az ifjúság lelki gondozása német nyelven],253 T79,,Schöningh,1933,lelkipásztorkodás; fiatalok pasztorációja,http://nektar.oszk.hu/hu/manifestation/1567461,
