szerzo,cim,jelzet,raktar,kiado,ev,targyszavak,kulso_leiras,megjegyzesek
"Staehelin, Balthasar",Lelki gyógyulás a keresztény lelki megújulás útján,248 S85,,Korda,1992,pszichoterápia és vallás,http://nektar.oszk.hu/hu/manifestation/47840,
Varsányi István,Lengyel társalgási zsebkönyv,800 Lengyel V52,,Tankvk.,1972,nyelvkönyv; lengyel nyelv,http://nektar.oszk.hu/hu/manifestation/1208552,
Caterina da Siena (Sziénai Szt Katalin),Levelek,"235.3A Katalin, Sziénai Szt",,Szt. István Társ.,1983,egyháztörténet; avignoni fogság; hagiográfia; szentek élete; misztika; hitélet; források,http://nektar.oszk.hu/hu/manifestation/673123,
Hegyi Béla,"Magunk vallomásai, A : Portrék és beszélgetések",929 Vegyes,,Ecclesia,1979,keresztény irodalom; katolikus egyház; egyház és állam; vallás és kultúra; interjúk; Nyíri Tamás; Szennay András; Gál Ferenc; Beresztóczy Miklós; Horváth Richárd; Possonyi László; Thurzó Gábor; Pilinszky János; Sík Sándor; Rónay György; Magyar Ferenc; Szigeti Endre; Ijjas Antal; Kunszery Gyula; Ujlaki Andor; Bibó Lajos; Bálint Sándor; Ignácz Rózsa; Kézai Béla,http://nektar.oszk.hu/hu/manifestation/673766,
Országh László,Magyar - angol szótár ,800 Angol O73,,Akadémiai,1979,kézikönyv,http://nektar.oszk.hu/hu/manifestation/565120,
Györkösy Alajos,Magyar - latin szótár,800 Latin G93,,Akadémiai,1998,kézikönyv,http://nektar.oszk.hu/hu/manifestation/291861,
Tipray János,Magyar és német iskolai szótár. Magyar - német rész,800 Német T54,,Franklin,1901,kézikönyv,http://nektar.oszk.hu/hu/manifestation/3597176,
Kelemen Béla,"Magyar és német nagy kézi szótár, tekintettel a két nyelv szólásaira = Grosses Handwörterbuch der ungarischen und deutschen Sprache 1-2. köt.",800 Német K30,,Athenaeum,1912-1914,kézikönyv,http://nektar.oszk.hu/hu/manifestation/1567367,
Miklósi László,Magyar hősök öt világrészen,270 M66,,szerző,1936,magyar egyháztörténet; missziótörténet,http://nektar.oszk.hu/hu/manifestation/1547038,
Frenyó Zoltán,"Magyar katolikus gondolkodó, Egy : Mihelics Vid életműve",929 Mihelics V.,,METEM,2002,Egyház társadalmi tanítása; életrajz,http://nektar.oszk.hu/hu/manifestation/942179,
Csapodi Csaba - Tóth András - Vértesy Miklós,Magyar könyvtártörténet,930.85 C42,,Gondolat,1987,kézikönyv,http://nektar.oszk.hu/hu/manifestation/660055,
Pap Dénes (közread.),"Magyar nemzetgyülés Pesten 1848-ban, A 1-2. köt.",943.9 M14,,Ráth M.,1866,magyar történelem; 1848-1849-es forradalom és szabadságharc; országgyűlés,http://nektar.oszk.hu/hu/manifestation/3111776,
Verbényi László - Könings Félix - Tardos Ferenc,Magyar-német külkereskedelmi szótár,800 Német V68,,Közgazd. és Jogi,1960,kézikönyv,http://nektar.oszk.hu/hu/manifestation/1238232,
"Paget, John",Magyarország és Erdély : Válogatás,908 Magyarország,,Helikon,1987,honismeret; helytörténet; magyar történelem; művelődéstörténet; útleírás,http://nektar.oszk.hu/hu/manifestation/787955,
Szeremlei Samu,Magyarország krónikája az 1848. és 1849. évi forradalom idejéről 1-2. köt. (egybekötve),943.9 Sz74,,Emich,1867,magyar történelem; 1848-1849-es forradalom és szabadságharc; kronológia,http://nektar.oszk.hu/hu/manifestation/3088307,
Kis Aladár,Magyarország külpolitikája a második világháború előestéjén : 1938. nov. - 1939. szept.,943.9 K49,,Kossuth,1963,magyar történelem; külpolitika; Horthy-korszak,http://nektar.oszk.hu/hu/manifestation/1245909,
Hőke Lajos,Magyarország újabbkori történelme 1815-től 1892-ig 1-2. köt.,943.9 H93,,Pleitz Ny.,1893,magyar történelem; reformkor; 1848-1849-es forradalom és szabadságharc; Bach-korszak; kiegyezés; Osztrák-Magyar Monarchia,http://nektar.oszk.hu/hu/manifestation/3517926,
Gerzsenyi Sándor (sajtó alá rend.),"Magyarországi Baptista Egyház alapokmányai, A : Baptista hitvallás; Baptista egyházszervezeti szabályzat",286 M18,,Interpress,1974,magyar protestáns egyházak; egyházszervezet,http://nektar.oszk.hu/hu/manifestation/1209109,
Möller Károly,"Mai technika, A",620 M92,,Egyetemi Ny.,1939,művelődéstörténet; technikatörténet; találmányok,http://nektar.oszk.hu/hu/manifestation/1586485,
Galla Ferenc,Marnavics Tomkó János boszniai püspök magyar vonatkozásai,270 G21,,Római Magyar Tört. Intézet,1940,egyháztörténet; Magyarország; életrajz,http://nektar.oszk.hu/hu/manifestation/1600500,
Békés Gellért (összeáll.),Mindszenty József a népbíróság előtt,929 Mindszenty J.,,Pannon,1989,magyar történelem; magyar egyháztörténet; egyház és állam; politikai per,http://nektar.oszk.hu/hu/manifestation/544570,
Damján Zsolt,Nagyboldogasszony oltalmában : szemelvények a bajsai római katolikus egyházközség történetéből ,270 D16,,szerző,2000,magyar egyháztörténet; kalocsai érsekség; szabadkai püspökség; plébániatörténet,http://nektar.oszk.hu/hu/manifestation/927573,
Papp Imre,"Napkirály, A : XIV. Lajos élete és kora",944 P32,,Kossuth,1989,francia történelem; életrajz,http://nektar.oszk.hu/hu/manifestation/602449,
Ballagi Mór,Német - magyar kéziszótár; Magyar - német kéziszótár 1-2. köt. (egybekötve),800 Német B22,,Franklin,1894,kézikönyv,http://nektar.oszk.hu/hu/manifestation/3071101,
Horváth Miklós - Paulinyi Zoltán,Német társalgási zsebkönyv,800 Német H90,,Tankvk.,1959,nyelvkönyv; német nyelv,http://nektar.oszk.hu/hu/manifestation/1202857,
Halász Előd,Német-magyar szótár,800 Német H17,,Akadémiai,1955,kézikönyv,http://nektar.oszk.hu/hu/manifestation/1200745,
Kalotás Zsolt (szerk.),Nemzeti parkjaink : jelen és jövő,500 N62,,Aqua,1996,természetvédelem; környezetvédelem; Magyarország; fotóalbum; képeskönyv,http://nektar.oszk.hu/hu/manifestation/180584,
Szennay András OSB,Nyitott kapuk egyháza,261 Sz60,,Bencés,1995,egyház és társadalom; hitélet; Magyarország; tanulmányok,http://nektar.oszk.hu/hu/manifestation/135596,
Gaál Zoltán,Nyugat-Magyarország és Kelet-Ausztria,908 Nyugat-Mo.,,szerző,1993,honismeret; helytörténet; Burgenland; Őrvidék,http://nektar.oszk.hu/hu/manifestation/78777,
Márki Sándor,"Ó- és középkor története, Az 1-2. köt.",940 M33,,Athenaeum,1910,egyetemes történelem; magyar történelem,http://nektar.oszk.hu/hu/manifestation/3108859,
Dallos György - Móritz György,Olasz nyelvkönyv az általános gimnáziumok 3. oszt. számára,800 Olasz D12,,Tankvk.,1954,középiskolai tankönyv,http://nektar.oszk.hu/hu/manifestation/1276898,
Fényes Elek,"Orosz-török háború, történeti jegyzetekkel, okiratokkal, a szereplő jelesb férfiak, vezérek életrajzával, Az 1-2. köt. (egybekötve)",940 F46,,Landerer - Heckenast,1854,"történelem; Európa története; hadtörténet; Oroszország, Törökország; történelmi források",http://nektar.oszk.hu/hu/manifestation/3059926,
Actio Catholica Országos Elnöksége (közread.),Országos Katolikus Nagygyűlés 30. : 1942. október 2-8.,270 O74,,Stephaneum Ny.,1942,magyar egyháztörténet,http://nektar.oszk.hu/hu/manifestation/3192057,
Actio Catholica Országos Elnöksége (közread.),Országos Katolikus Nagygyűlés 31. : 1943. október 1-6. ,270 O74,,Stephaneum Ny.,1944,magyar egyháztörténet,http://nektar.oszk.hu/hu/manifestation/3216181,
Kákay Aranyos,Országgyűlési árny- és fényképek,320 K11,,Emich,1861,magyar irodalom; belpolitika; Magyarország; politikai élet; parlament; esszék; karcolatok,http://nektar.oszk.hu/hu/manifestation/3032857,
Czeizel Endre,"Orvos-genetikus szemével, Az",610 C93,,Minerva,1980,orvostudomány; genetika; öröklődés; tehetség,http://nektar.oszk.hu/hu/manifestation/646520,
Kocsis Elemér (szerk.),Ökumenikus Tanács nyilatkozata és köszöntése 1991. augusztus 18-án,261.8 Ö20,,Ref. Püspöki Hiv.,1991,ökumené,http://nektar.oszk.hu/hu/manifestation/507201,
"Nehru, Jawaharlal",Önéletrajz,"929 Nehru, D.",,Szikra,1956,történelem; India; politikus,http://nektar.oszk.hu/hu/manifestation/1226865,
Barsi Balázs OFM,Örökké megmarad : a Szeretethimnusz magyarázata,227 Kor B35,,Vágó L. G.,2003,"biblikum; Biblia, Újszövetség, 1. Korintusi levél; bibliamagyarázat; egzegézis; elmélkedések",http://nektar.oszk.hu/hu/manifestation/987235,
Szent-Györgyi Albert,"Őrült majom, Az",590 Sz61,,Magvető,1989,tudományfilozófia; biológia; biokémia; ember; civilizáció; etika; tanulmányok,http://nektar.oszk.hu/hu/manifestation/622371,
Pongrácz Sándor,"Ősködtől az emberig, Az",570 P84,,Franklin,1940,paleontológia; földtörténet; őslénytan; antropológia; biológia,http://nektar.oszk.hu/hu/manifestation/3402269,
Magyar László András (szerk.),Pandaemonium : a keresztény démonológia kistükre,235 0 P23,,Palimpszeszt Kult. Alapítvány - Kairosz,2003,szöveggyűjtemény,http://nektar.oszk.hu/hu/manifestation/1061907,
Mező András,Patrocíniumok a középkori Magyarországon,800 Magyar M61,,METEM,2003,magyar egyháztörténet; templomok; kolostorok; etimológia; adattár,http://nektar.oszk.hu/hu/manifestation/2503156,
Galla Ferenc,"Pázmáneum alapítása és a Szentszék, A",370 G21,,szerző,1935,neveléstörténet; papnevelés története; intézménytörténet; Bécs; forrás,http://nektar.oszk.hu/hu/manifestation/3292381,
Pethő Sándor,Politikai arcképek : az új Magyarország vezéregyéniségei,943.9 P63,,Élet Ny.,1911,magyar történelem; politikai élet; politikusok; életrajzok; Apponyi Albert; Andrássy Gyula; Grünwald Béla; Tisza Kálmán; Kossuth Lajos; Görgey Artúr; Szilágyi Dezső; Beöthy Ákos; Kállay Béni; Ugron Gábor; Kaas Ivor; Zichy Nándor,http://nektar.oszk.hu/hu/manifestation/3009987,
"Wiltgen, Ralph Michael SVD","Rajna a Tiberisbe ömlött, A : a második Vatikáni Zsinat története",262.5 W76,,Szt. István Társ.,1999,egyháztörténet; II. Vatikáni Zsinat; ,http://nektar.oszk.hu/hu/manifestation/366016,
Kiss Domonkos OSB,Régi magyarországi könyvek a pannonhalmi Szent Benedek-rendi Főkönyvtárban az 1786-os abolíciós katalógus alapján,930.85 K52,,Pannonhalmi Főapátság,1996,művelődéstörténet; könyvtártörténet; egyházi könyvtár; Pannonhalma; régi nyomtatványok,http://nektar.oszk.hu/hu/manifestation/206494,
Kónya Sándor - Országh László,Rendszeres angol nyelvtan,800 Angol K69,,Terra,1991,nyelvészet,http://nektar.oszk.hu/hu/manifestation/787730,
Hervay Ferenc Levente OCist,Repertorium historicum Ordinis Cisterciensis in Hungaria,271 OCist H64,,Ed. Cistercienses - Szt. István Társ.,1984,magyar egyháztörténet; szerzetesrendek története; ciszterci rend; források,http://nektar.oszk.hu/hu/manifestation/673137,
Luttor Ferenc,Róma : a város a történelem tükrében,937 L97,,Magyar Szemle Társ.,1931,történelem; Római Birodalom; Itália; Olaszország; művészettörténet; művelődéstörténet,http://nektar.oszk.hu/hu/manifestation/3320641,
,Romológiai alapismeretek,316 R80,,Corvinus,1999,cigányság; cigánykérdés; cigány néprajz; cigány nyelv; cigánykutatás; iskolai nevelés; kultúra; szocializáció; sczoviológia; életmód; kulturális antropológia; Magyarország; tanulmányok; felsőoktatási tankönyv,http://nektar.oszk.hu/hu/manifestation/361756,
Rácz Lajos,Rousseau J. J. élete és művei 1-2. köt.,"929 Rousseau, J. J.",,Akadémia,1928,irodalomtörténet; francia irodalom; filozófiatörténet; életrajz,http://nektar.oszk.hu/hu/manifestation/2932993,
Pajzs Elemér,Salazar : egy kis ország nagy építője,946.9 P12,,Auróra,1942,történelem; Európa története; Portugália; politikus,http://nektar.oszk.hu/hu/manifestation/2787311,
Puskely Mária SSND (összeáll.),Simon Erzsébet Mária Etelka iskolanővér : dokumentált életvázlat,929 Simon E. M. E.,,Miasszonyunkról Nevezett Szegény Iskolanővérek M. Tartománya,2005,szerzetesrendek története; életrajz,http://nektar.oszk.hu/hu/manifestation/2742606,
,Sopron,908 Sopron,,Képzőműv. Alap,1963,honismeret; helytörténet; fotóalbum; képeskönyv,http://nektar.oszk.hu/hu/manifestation/1205237,
Bánóczi József - Weszely Ödön (szerk.),Stilisztika és olvasókönyv a tanító- és tanítónőképző intézetek első osztálya számára,894.511 S92,,Lampel,1909,magyar irodalom; felsőoktatási tankönyv,http://nektar.oszk.hu/hu/manifestation/2727865,
Teleki Béla,Sürgető feladat : családpedagógiai gondolatok,370 T40,,Prugg,1985,családi élet; családi nevelés; gyermekpszichológia,http://nektar.oszk.hu/hu/manifestation/1401153,
Buday Barna (sajtó alá rend.),"Székely Kongresszus szervezete, tagjainak névsora, tárgyalásai és határozatai, A",320 Sz49,,Pátria Ny.,1902,gazdaságtörténet; gazdaságpolitika; Magyarország; Erdély; Székelyföld; székelyek; forrás; tanulmányok,http://nektar.oszk.hu/hu/manifestation/2724253,
,Szekfű Gyula a történetíró és nemzetnevelő 60. születésnapjára (Klny.: Magyar szemle 1943. máj.),930 Sz52,,Magyar Szemle Társ.,1943,történetírás; nemzetpolitika; életrajz; bibliográfia; emlékkönyv,http://nektar.oszk.hu/hu/manifestation/2881326,
Rátai János,"Szellem kalandjai életen innen és túl, A : Spiritizmus, parapszichológia",159.9 R39,,Minerva,1988,okkultizmus; ezoterika,http://nektar.oszk.hu/hu/manifestation/646995,
"Tacitus, Publius Cornelius",Szemelvények P. Cornelius Tacitus Annaleséből ,937 T12,,Franklin,1923,ókori történelem; Római Birodalom; történetírás; forrás,http://nektar.oszk.hu/hu/manifestation/3317003,
Hegedüs Géza,"Szent doktorok tudománya, A avagy A középkori gondolkodás évezrede",100 H49,,Kozmosz,1990,filozófiatörténet; civilizáció; Európa,http://nektar.oszk.hu/hu/manifestation/643679,
,"Szent Orsolya Római Katolikus Általános Iskola, Gimnázium és Kollégium jubileumi évkönyve alapításának 250. évfordulója alkalmából, A : 1747-1997",370 Sz61,,"Szt. Orsolya Római Kat. Ált. Isk., Gimn. és Koll.",1997,neveléstörténet; intézménytörténet; Sopron; emlékkönyv,http://nektar.oszk.hu/hu/manifestation/236763,
Gál Ferenc,"Szentlélek kiáradása, A",231 G17,,Szt. István Társ.,1986,dogmatika; biblikus teológia; karizmák; keresztség,http://nektar.oszk.hu/hu/manifestation/673243,
Dobos Marianne,"Szeretet önkéntesei, A",266 D71,,Fórum,1990,Magyar Máltai Szeretetszolgálat,http://nektar.oszk.hu/hu/manifestation/547551,
Dunai N. János,Szülőföldem a Drávaszög,908 Drávaszög,,Horvátországi M. Tud. és Műv. Társ.,1999,honismeret,http://nektar.oszk.hu/hu/manifestation/839954,
Kulin György - Zerinváry Szilárd,"Távcső világa, A",520 K97,,Gondolat,1958,csillagászat,http://nektar.oszk.hu/hu/manifestation/1286423,
Sugár András,"Távolságot, mint üveggolyót, A",910 S95,,Gondolat,1977,útleírás,http://nektar.oszk.hu/hu/manifestation/657379,
Csőgl János,Tedd magad igaz emberré : Életünk problémái a mai irodalom tükrében,241 C82,,Szt. István Társ.,1981,keresztény élet; valláserkölcs; hitélet; magyar irodalom,http://nektar.oszk.hu/hu/manifestation/673024,
"Read, Piers Paul","Templomosok, A",271 PCCTS R44,,Gulliver,2001,történelem; hadtörténet; művelődéstörténet; egyháztörténet; szerzetesrendek története; Templomos Lovegrend; középkor; keresztes háborúk,http://nektar.oszk.hu/hu/manifestation/802033,
Cserháti József (szerk.),Teológiai évkönyv : mai indítások a lelkipásztori munkához,230 T43,,Szt. István Társ.,1975,katolikus egyház; lelkipásztorkodás,http://nektar.oszk.hu/hu/manifestation/2780250,
Sztrókay Kálmán,"Természet titkai nyomában, A",530 Sz95,,Egyetemi Ny.,1942,tudománytörténet; fizika,http://nektar.oszk.hu/hu/manifestation/2744468,
"Darwin, Charles","Természettudós utazásai, Egy",500 D28,,Művelt Nép,1951,tudománytörténet; természettudomány; természetismeret; földrajz; biológia; geológia; földtan; útleírás; napló,http://nektar.oszk.hu/hu/manifestation/3029502,
"Tacitus, Publius Cornelius",Tiberius és kora : Kr. u. 14 - 19.,937 T12,,Franklin,1943,ókori történelem; Római Birodalom története; császárkor; történetírás; életrajz,http://nektar.oszk.hu/hu/manifestation/3459998,
"Fruin, Robert",Tíz év a németalföldi szabadságharcból 1588-1598 1-2. köt.,946 F94,,Akadémia,1916-1917,történelem; Európa története,http://nektar.oszk.hu/hu/manifestation/2932088,
Bertényi Iván (szerk.),"Történelem segédtudományai, A",930 T88,,Pannonica - Osiris,1998,diplomatika; oklevéltan; paleográfia; írástörténet; epigráfia; felirattan; kodikológia; kézirattan; kronológia; időszámítás; papirológia; genealógia; származástan; archontológia; heraldika; címertan; falerisztika; kitüntetéstan; inszigniológia; jelvénytan; vexillológia; zászlótan; metrológia; mértéktörténet; numizmatika; pénztörténet; történeti földrajz; éghajlattan; névtan; ikonográfia; szfragisztika; pecséttan,http://nektar.oszk.hu/hu/manifestation/334838,
Veresegyházi Béla,Történelmi-topográfiai kislexikon,030 V69,,Aqua,1994,"történeti földrajz, kézikönyv",http://nektar.oszk.hu/hu/manifestation/84014,
Szabó Árpád,"Trójai háború, A",Sz12,,Ifj. Kiadó,1957,magyar irodalom; ókori Görögország; mitológia; történelmi regény; ifjúsági irodalom,http://nektar.oszk.hu/hu/manifestation/1229864,
Nemesszeghy Ervin SJ,"Tudomány, hit, bölcselet : összegyűjtött tanulmányok és előadások",215 N48,,Korda,1995,vallás és tudomány; vallásfilozófia; tudományfilozófia; magyar jezsuiták; interjú,http://nektar.oszk.hu/hu/manifestation/135892,
Öveges József Piar (szerk.),"Tudomány, technika, élet ",530 T93,,Tankvk.,1960,fizika; kísérletek,http://nektar.oszk.hu/hu/manifestation/1239072,
"Jeans, James","Új fizika világképe, Az",530 J53,,Egyetemi Ny.,1945,fizika és filozófia,http://nektar.oszk.hu/hu/manifestation/3497414,
Kákay Aranyos,Újabb árny- és fényképek,320 K11,,Ráth M.,1866,magyar irodalom; belpolitika; Magyarország; politikai élet; kormány; országgyűlés; parlament; esszék; karcolatok,http://nektar.oszk.hu/hu/manifestation/3057651,
Fekete Gyula,Ungarn : Mit 237 Farbbildern,908 Magyarország,,Corvina,1989,honismeret; képeskönyv; fotóalbum; német nyelven,http://nektar.oszk.hu/hu/manifestation/618671,
Szabó Ferenc (szerk.),Üldözött jezsuiták vallomásai,271 SJ Ü26,,Jézus Társasága Mo. Rendtartománya,1995,magyar egyháztörténet; szerzetesrendek története; jezsuita rend; magyar jezsuiták; egyházüldözés; politikai terror; memoárok,http://nektar.oszk.hu/hu/manifestation/130561,
Teleki Béla,"Ünneplés művészete, Az",390 t40,,Forrás Egyes.,1992,keresztény nevelés; családi életre nevelés; szokások,http://nektar.oszk.hu/hu/manifestation/55142,
Detre László,Üzenetek a világűrből : kozmikus hatások a földön,520 D57,,Egyetemi Ny.,1939,csillagászat; Naprendszer; űrkutatás,http://nektar.oszk.hu/hu/manifestation/1589967,
Kovács András,Vallomás a székely szombatosok perében,308 K76,,Magvető,1983,magyar történelem; Erdély története; vallástörténet; szociográfia,http://nektar.oszk.hu/hu/manifestation/655804,
Hévey Gyula ,Vázlatok a katholikus missziók életéből ,270 H69,,Szt. István Társ.,1914,egyháztörténet; missziótörténet,http://nektar.oszk.hu/hu/manifestation/3068722,
Kisfalusi János,"Védett Cserehát, A",908 Cserehát,,magánkiad.,2001,honismeret,http://nektar.oszk.hu/hu/manifestation/909443,
Pethő Sándor - Fodor Ferenc,Világostól Trianonig : a mai Magyarország kialakulásának története,943.9 P63,,Enciklopédia,1925,magyar történelem; Bach-korszak; kiegyezés; Osztrák-Magyar Monarchia; I. világháború; trianoni békeszerződés,http://nektar.oszk.hu/hu/manifestation/3190491,
,,,,,,,,
,,,,,,,,
,,,,,,,,
,,,,,,,,
,,,,,,,,
,,,,,,,,
,,,,,,,,
,,,,,,,,
,,,,,,,,
,,,,,,,,
"Livius, Titus",Ab urbe condita : liber XXI. et XXII.,937 L74,,Athenaeum,1918,ókori latin irodalom; történetírás; Róma története; forrás,http://nektar.oszk.hu/hu/manifestation/2975577,
Szalay László,Adalékok a magyar nemzet történetéhez a XVI. században ,943.9 Sz27,,Ráth,1859,magyar történelem,http://nektar.oszk.hu/hu/manifestation/3010137,
Záborszky István,"Alter Christus eszménye felé, Az",254 Z10,,Korda,1943,pasztorálteológia; papnevelés; papnövendék; szeminárium; házirend; reverenda; imaélet; elmélkedés; rózsafüzér; lelki olvasmány; Szentírás olvasása; szentgyónás; lelkiismeretvizsgálat; Eucharisztia; lelkivezetés; lelki szárazság; önmegtagadás; lelkiismeret; lelkigyakorlat; rekollekció; szünidő,http://nektar.oszk.hu/hu/manifestation/2871022,
Kristó Gyula,"Árpád-kor háborúi, Az",943.9 K95,,Zrínyi,1986,magyar történelem; hadtörténet; középkor,http://nektar.oszk.hu/hu/manifestation/668334,
"Thierry, Amédeé",Attila : Attila fiai és utódai történelme a magyarok Európába telepedéséig,943.9 T50,,Ráth,1865,történelem; hunok története; magyar őstörténet; Kárpát-medence,http://nektar.oszk.hu/hu/manifestation/3019666,
Bakk Endre,"Bak és Jancsó család története, A",929 Bak,,Hunyadi Mátyás Ny.,1883,családtörténet; Bakk család; Jancsó család,http://nektar.oszk.hu/hu/manifestation/3020063,
Erdélyi Pál,Balassa Bálint 1551-1594,929 MTÉ 35,,Magyar Tört. Társ.,1899,magyar történelem; magyar irodalom; Magyar történeti életrajzok sorozat,http://nektar.oszk.hu/hu/manifestation/1554362,
Berzeviczy Albert,Beatrix királyné 1457-1508,929 MTÉ 52,,Magyar Tört. Társ.,1908,magyar történelem; I. Mátyás király; Magyar történeti életrajzok sorozat,http://nektar.oszk.hu/hu/manifestation/1554380,
Bartal György,Béla király halhatatlan jegyzőjének Mátyásnak újabb diadaláról (Klny. az Akadémiai Értesítőből),943.9 B36,,Emich Ny.,1861,Mátyás zágrábi prépost,http://nektar.oszk.hu/hu/manifestation/3020075,
Vass József,Béla király névtelen jegyzőjének kora,943.9 V58,,Kugler,1865,magyar történelem; magyar őstörténet; honfoglalás; Anonymus; történetírás; Gesta Hungarorum,http://nektar.oszk.hu/hu/manifestation/3015657,
Veress Endre,Berzeviczy Márton 1538-1596,929 MTÉ 55,,Magyar Tört. Társ.,1911,magyar történelem; Erdély története; politikus; Magyar történeti életrajzok sorozat,http://nektar.oszk.hu/hu/manifestation/1554381,
Gindely Antal - Acsády Ignácz,Bethlen Gábor és udvara 1580-1629,929 MTÉ 20,,Magyar Tört. Társ.,1890,magyar történelem; Erdély története; művelődéstörténet; Magyar történeti életrajzok sorozat,http://nektar.oszk.hu/hu/manifestation/1554340,
Szilágyi Sándor,Bethlen Gábor fejedelem trónfoglalása,943.9 Sz80,,Akadémia,1867,magyar történelem; Erdély története; politikatörténet; diplomácia,http://nektar.oszk.hu/hu/manifestation/3393368,
Kubinyi Miklós,Bethlenfalvi gróf Thurzó Imre 1598-1621,929 MTÉ 11,,Méhner,1888,magyar történelem; Magyar történeti életrajzok sorozat,http://nektar.oszk.hu/hu/manifestation/1554330,
Rózsa Huba (sajtó alá rend.),Biblia : Ószövetségi és Újszövetségi Szentírás,220B0 B61,,Szt. István Társ.,2006,biblikum,http://nektar.oszk.hu/hu/manifestation/2629191,
Feley Lóránt,"Condottiere hadrendszer és Mátyás hadserege, A",943.9 F41,,Szt. Erzsébet Ny.,1913,magyar történelem; hadtörténet; I. Mátyás király,http://nektar.oszk.hu/hu/manifestation/3024226,
Pray György SJ,Dissertationes historico-criticae de sanctis Salomone rege et Emerico duce Hungariae,235.3 Vegyes,,Landerer,1774,magyar történelem; Árpád-ház; Salamon király; Szt Imre; hagiográfia; szentek élete,http://nektar.oszk.hu/hu/manifestation/3123388,
Kovács János István - Soós Ádám,Elfelejtett évtizedek : Pálhidy Mihály emlékkönyv,908 Hatvan,,Pálhidy M. Hagyományőrző Polg. Egyes. - Szülőföldünkért Hagyományőrző és Kult. Alapítvány,2001,helytörténet; Hatvan; életrajz; tanulmányok,http://nektar.oszk.hu/hu/manifestation/911407,
Karácsonyi János,"Első Lónyayak, Az : családtörténeti tanulmány",929 Lónyay,,Szt. László Ny.,1904,családtörténet; Lónyay család; forrás,http://nektar.oszk.hu/hu/manifestation/3115120,
Pesty Frigyes,"Eltűnt régi vármegyék, Az 1-2. köt.",943.9 P59,,Akadémia,1880,magyar történelem; történeti földrajz; közigazgatás,http://nektar.oszk.hu/hu/manifestation/1567891,
Révész Imre,"Etel Laka, vagyis Attila hun király birodalmi székhelye : történelmi vizsgálat",943.9 R67,,"Városi Ny., Debrecen",1859,történelem; hunok története; magyar őstörténet,http://nektar.oszk.hu/hu/manifestation/3016673,
Ráth-Végh István,Fejedelmi bálvány,930.85 R39,,Művelt Nép,1954,művelődéstörténet; Európa; tanulmányok,http://nektar.oszk.hu/hu/manifestation/1221212,
Wenzel Gusztáv,Frangepán Kristóf velenczei fogsága : 1514-19 : nagyobb részt még ismeretlen egykorú levelezések és egyéb kútfőkről ,943.9 W58,,Eisenfels-Emich Ny.,1850,magyar történelem; börtönnapló; levelek,http://nektar.oszk.hu/hu/manifestation/3061112,
Morvay Győző,Galánthai gróf Fekete János,929 MTÉ 43,,Magyar Tört. Társ.,1903,magyar történelem; magyar irodalom; irodalomtörténet; felvilágosodás; Magyar történeti életrajzok sorozat,http://nektar.oszk.hu/hu/manifestation/1554368,
"Marzio, Galeotto","Martius Galeot könyve Mátyás király jeles, bölcs és elmés mondásai és tetteiről",943.9 M39,,Ráth,1863,magyar történelem; I. Mátyás király; humanizmus; reneszánsz; életrajz,http://nektar.oszk.hu/hu/manifestation/3018023,
Bártfai Szabó László,Ghymesi Forgách Ferencz 1535-1577,929 MTÉ 44,,Magyar Tört. Társ.,1904,magyar történelem; történetírás; politikatörténet; humanizmus; politikus; Magyar történeti életrajzok sorozat,http://nektar.oszk.hu/hu/manifestation/1554369,
